{
  "schema_version": 1,
  "episode_id": "human_library_rank2_forgotten_civilization_pilot5",
  "title": "잊혀진 문명, 세계 최강이 사라진 이유 (Pilot-5 23.5s)",
  "target_duration_sec": 23.5,
  "total_shots": 5,
  "total_sentences": 5,
  "pacing_summary": {
    "opening_cuts": 3,
    "tier1_cuts": 2,
    "tier2_cuts": 0,
    "tier3_cuts": 0
  },
  "shots": [
    {
      "shot_id": "SHOT_001",
      "order": 1,
      "pacing_tier": "Opening",
      "look_type": "context_wide",
      "motion_profile": {
        "motion_family": "push_in",
        "axis": "z_forward",
        "phases": [
          "constant"
        ]
      },
      "duration_sec": 3.5,
      "start_sec": 0.0,
      "end_sec": 3.5,
      "sentence_spans": [
        "SENT_001"
      ],
      "spoken_text": "클레오파트라한테 피라미드는 이미 고대 유물이었습니다.",
      "display_text": "클레오파트라한테 피라미드는 이미 고대 유물이었습니다.",
      "visual": {
        "subject": "나일강 상공과 멀리 보이는 피라미드 실루엣의 거대한 일몰 전경",
        "place": "Various historical settings",
        "era": "Pleistocene to Modern Era",
        "action": "Authentic historical and evolutionary adaptation behavior",
        "tone": "Photorealistic 35mm cinematic documentary",
        "prompt_en": "Cinematic wide aerial establishing shot of the Nile river winding through fertile green banks and golden desert cliffs, distant pyramid silhouettes at sunset, 2D Ligne Claire, flat cel-shaded coloring, Korean webtoon documentary aesthetic, high contrast, sharp ink line art, Keep bottom 18% visually clear for subtitles"
      }
    },
    {
      "shot_id": "SHOT_002",
      "order": 2,
      "pacing_tier": "Opening",
      "look_type": "subject_action",
      "motion_profile": {
        "motion_family": "pan",
        "axis": "x_right",
        "phases": [
          "constant"
        ]
      },
      "duration_sec": 4.0,
      "start_sec": 3.5,
      "end_sec": 7.5,
      "sentence_spans": [
        "SENT_002"
      ],
      "spoken_text": "우리한테 클레오파트라가 먼 옛날 사람인 것처럼 클레오파트라한테도 피라미드는 아득 먼 옛날 이야기였어요.",
      "display_text": "우리한테 클레오파트라가 먼 옛날 사람인 것처럼 클레오파트라한테도 피라미드는 아득 먼 옛날 이야기였어요.",
      "visual": {
        "subject": "클레오파트라 시대 알렉산드리아 도서관과 고대 서고의 학자들",
        "place": "Various historical settings",
        "era": "Pleistocene to Modern Era",
        "action": "Authentic historical and evolutionary adaptation behavior",
        "tone": "Photorealistic 35mm cinematic documentary",
        "prompt_en": "Medium action shot of Queen Cleopatra and Egyptian scribes inspecting weathered papyrus scrolls inside ancient Alexandria library hall, 2D Ligne Claire, flat cel-shaded coloring, Korean webtoon documentary aesthetic, high contrast, sharp ink line art, Keep bottom 18% visually clear for subtitles"
      }
    },
    {
      "shot_id": "SHOT_003",
      "order": 3,
      "pacing_tier": "Opening",
      "look_type": "evidence_detail",
      "motion_profile": {
        "motion_family": "pull_out",
        "axis": "z_backward",
        "phases": [
          "constant"
        ]
      },
      "duration_sec": 4.5,
      "start_sec": 7.5,
      "end_sec": 12.0,
      "sentence_spans": [
        "SENT_003"
      ],
      "spoken_text": "그 정도로 오래된 문명인데이 문명의 글자를 읽을 수 있는 사람이 지부상에서 전부 사라진 적이 있습니다.",
      "display_text": "그 정도로 오래된 문명인데이 문명의 글자를 읽을 수 있는 사람이 지부상에서 전부 사라진 적이 있습니다.",
      "visual": {
        "subject": "풍화된 신전 석벽에 새겨진 고대 이집트 상형문자 매크로 부조",
        "place": "Various historical settings",
        "era": "Pleistocene to Modern Era",
        "action": "Authentic historical and evolutionary adaptation behavior",
        "tone": "Photorealistic 35mm cinematic documentary",
        "prompt_en": "Macro close-up shot of ancient Egyptian hieroglyphs carved into weathered limestone temple wall, raking dramatic desert sidelight, 2D Ligne Claire, flat cel-shaded coloring, Korean webtoon documentary aesthetic, high contrast, sharp ink line art, Keep bottom 18% visually clear for subtitles"
      }
    },
    {
      "shot_id": "SHOT_004",
      "order": 4,
      "pacing_tier": "Tier 1",
      "look_type": "medium_portrait",
      "motion_profile": {
        "motion_family": "push_in",
        "axis": "z_forward",
        "phases": [
          "constant"
        ]
      },
      "duration_sec": 5.5,
      "start_sec": 12.0,
      "end_sec": 17.5,
      "sentence_spans": [
        "SENT_004"
      ],
      "spoken_text": "1400년 동안 단 한 명도요.",
      "display_text": "1400년 동안 단 한 명도요.",
      "visual": {
        "subject": "클레오파트라와 피라미드의 아득한 시간 거리 왜곡",
        "place": "Various historical settings",
        "era": "Pleistocene to Modern Era",
        "action": "Authentic historical and evolutionary adaptation behavior",
        "tone": "Photorealistic 35mm cinematic documentary",
        "prompt_en": "Poetic split composition showing Queen Cleopatra in Roman era Alexandria contrasting with 2500-year-older pyramids, 2D Ligne Claire, flat cel-shaded coloring, Korean webtoon documentary aesthetic, high contrast, sharp ink line art, Keep bottom 18% visually clear for subtitles"
      }
    },
    {
      "shot_id": "SHOT_005",
      "order": 5,
      "pacing_tier": "Tier 1",
      "look_type": "artifact_macro",
      "motion_profile": {
        "motion_family": "biphasic_ken_burns",
        "axis": "compound",
        "phases": [
          "phase1_reframe",
          "phase2_approach"
        ]
      },
      "duration_sec": 6.0,
      "start_sec": 17.5,
      "end_sec": 23.5,
      "sentence_spans": [
        "SENT_005"
      ],
      "spoken_text": "3,년이요.이 이 숫자가 어느 정도인지 한번 생각해 보세요.",
      "display_text": "3,년이요.이 이 숫자가 어느 정도인지 한번 생각해 보세요.",
      "visual": {
        "subject": "1400년 동안 침묵 속에 묻힌 상형문자의 죽음",
        "place": "Various historical settings",
        "era": "Pleistocene to Modern Era",
        "action": "Authentic historical and evolutionary adaptation behavior",
        "tone": "Photorealistic 35mm cinematic documentary",
        "prompt_en": "Mysterious macro shot of forgotten stone cartouche covered with desert sand and silence, 2D Ligne Claire, flat cel-shaded coloring, Korean webtoon documentary aesthetic, high contrast, sharp ink line art, Keep bottom 18% visually clear for subtitles"
      }
    }
  ]
}